{
  "$schema": "https://raw.githubusercontent.com/liangboqiang/TjuaeHub/main/schemas/asset-package.v1.schema.json",
  "schemaVersion": 1,
  "name": "tjuaeasset-assistant-pitch-deck-creator",
  "version": "1.0.0",
  "displayName": "路演 PPT 助手",
  "description": "制作投资路演、产品发布和企业销售演示文稿，包含渐变设计、数据图表、竞品表格、团队页和演讲者备注。支持从种子轮到 A 轮及以上的路演。",
  "author": "Tjuae",
  "compatibility": {
    "tjuae": "^1.0.0"
  },
  "publisher": {
    "name": "Tjuae",
    "url": "https://github.com/liangboqiang"
  },
  "source": {
    "repository": "https://github.com/liangboqiang/TjuaeCore/"
  },
  "tags": ["assistant", "official"],
  "assets": [
    {
      "kind": "assistant",
      "id": "pitch-deck-creator",
      "runtimeId": "pitch-deck-creator",
      "definitionFile": "assistant.json",
      "dependencies": []
    }
  ]
}
