{
  "$schema": "https://raw.githubusercontent.com/liangboqiang/TjuaeHub/main/schemas/asset-package.v1.schema.json",
  "schemaVersion": 1,
  "name": "tjuaeasset-assistant-financial-model-creator",
  "version": "1.0.0",
  "displayName": "财务建模助手",
  "description": "根据文本描述构建公式驱动的财务模型：三表联动、DCF 估值、股权表、情景分析、敏感性分析和债务计划。所有数值通过公式链从假设条件层层推导。",
  "author": "Tjuae",
  "compatibility": {
    "tjuae": "^1.0.0"
  },
  "publisher": {
    "name": "Tjuae",
    "url": "https://github.com/liangboqiang"
  },
  "source": {
    "repository": "https://github.com/liangboqiang/TjuaeCore/"
  },
  "tags": ["assistant", "official"],
  "assets": [
    {
      "kind": "assistant",
      "id": "financial-model-creator",
      "runtimeId": "financial-model-creator",
      "definitionFile": "assistant.json",
      "dependencies": []
    }
  ]
}
