{
  "$schema": "https://raw.githubusercontent.com/liangboqiang/TjuaeHub/main/schemas/asset-package.v1.schema.json",
  "schemaVersion": 1,
  "name": "tjuaeasset-openclaw-gateway",
  "version": "1.0.0",
  "displayName": "OpenClaw",
  "description": "将 OpenClaw 作为 ACP 适配器集成到 TjuaeUI。",
  "author": "Tjuae",
  "compatibility": {
    "tjuae": "^1.0.0"
  },
  "source": {
    "repository": "https://github.com/liangboqiang/TjuaeHub/"
  },
  "review": {
    "status": "underReview",
    "reason": "候选适配器尚未通过可复现安装、安全和运行兼容性验收。",
    "unsupportedKinds": []
  },
  "tags": ["engineAdapter"],
  "assets": [
    {
      "kind": "engineAdapter",
      "id": "openclaw-gateway",
      "runtimeId": "openclaw-gateway",
      "definitionFile": "engine-adapter.json",
      "dependencies": []
    }
  ]
}
