{
  "$schema": "https://raw.githubusercontent.com/liangboqiang/TjuaeHub/main/schemas/asset-package.v1.schema.json",
  "schemaVersion": 1,
  "name": "tjuaeasset-skill-tjuaeui-troubleshooting",
  "version": "1.0.0",
  "displayName": "tjuaeui-troubleshooting",
  "description": "通过只读诊断命令检查 TjuaeUI 会话、Provider、任务、MCP 和后端状态。",
  "author": "Tjuae",
  "compatibility": {
    "tjuae": "^1.0.0"
  },
  "publisher": {
    "name": "Tjuae",
    "url": "https://github.com/liangboqiang"
  },
  "source": {
    "repository": "https://github.com/liangboqiang/TjuaeCore/"
  },
  "tags": ["official", "skill"],
  "assets": [
    {
      "kind": "skill",
      "id": "tjuaeui-troubleshooting",
      "runtimeId": "tjuaeui-troubleshooting",
      "definitionFile": "SKILL.md",
      "dependencies": []
    }
  ]
}
