{
  "$schema": "https://raw.githubusercontent.com/liangboqiang/TjuaeHub/main/schemas/asset-package.v1.schema.json",
  "schemaVersion": 1,
  "name": "tjuaeasset-codebuddy",
  "version": "1.0.0",
  "displayName": "CodeBuddy",
  "description": "将 CodeBuddy 作为 ACP 适配器集成到 TjuaeUI。",
  "author": "Tjuae",
  "compatibility": {
    "tjuae": "^1.0.0"
  },
  "source": {
    "repository": "https://github.com/liangboqiang/TjuaeHub/"
  },
  "tags": ["engineAdapter"],
  "assets": [
    {
      "kind": "engineAdapter",
      "id": "codebuddy",
      "runtimeId": "codebuddy",
      "definitionFile": "engine-adapter.json",
      "dependencies": []
    }
  ]
}
